{
  "_meta": {
    "stage": "news",
    "by": "示例",
    "at": "2026-10-14T06:00:00+08:00"
  },
  "week": "10.06–10.12",
  "items": [
    {
      "flag": "🇬🇧",
      "place": "英国 · 伦敦",
      "title": "11 岁女孩成为最年轻的“女子特级大师”",
      "text": "伦敦女孩 Bodhana 打破了 12 岁的旧纪录。她 2020 年才开始学棋，老师是网上视频！",
      "word": {
        "en": "record",
        "zh": "纪录"
      },
      "photo_url": "见 credits",
      "photo_credit": "见 credits",
      "photo_pos": "center 60%",
      "photo_shows": "一副摆好的国际象棋棋盘，白色王后立在最前面",
      "talk": {
        "background": "2020 年她在家里翻爸爸的旧袋子，发现了国际象棋，本来只想拿棋子当玩具，结果迷上了下棋。",
        "scale": "女子特级大师是国际象棋女子最高终身头衔，全世界拿到的人不到五百位。",
        "follow_up": "你有没有哪样本领，也是看视频或自己琢磨学会的？"
      },
      "sources": [
        "https://newsforkids.net/articles/2026/10/08/british-girl-11-is-worlds-youngest-woman-grandmaster/",
        "https://www.ctvnews.ca/lifestyle/article/british-schoolgirl-becomes-chess-youngest-ever-woman-grandmaster/"
      ]
    },
    {
      "flag": "🇺🇸",
      "place": "美国 · 佛罗里达",
      "title": "鹈鹕敲门求救",
      "text": "一只鹈鹕用嘴“咚咚”敲实验室的门，翅膀扎着鱼钩。科学家花 10 分钟取下，它飞走了。",
      "word": {
        "en": "help",
        "zh": "帮助"
      },
      "photo_url": "见 credits",
      "photo_credit": "见 credits",
      "photo_pos": "center 40%",
      "photo_shows": "一只长着大嘴巴和喉囊的褐鹈鹕站在海边木桩上",
      "talk": {
        "background": "美国海洋与大气管理局的科学家正在屋里办公，听见门口咚咚响，打开门一看，一只受伤的褐鹈鹕正站在台阶上等他们。",
        "scale": "褐鹈鹕展开翅膀有两米多宽，比一个高个子大人张开双臂还要长。",
        "follow_up": "这只鹈鹕是怎么知道门后面有人能帮它的呢？"
      },
      "sources": [
        "https://newsforkids.net/articles/2026/10/01/injured-pelican-knocks-noaa-scientists-answer/",
        "https://www.adn.com/alaska-news/wildlife/2026/09/20/scientists-heard-a-knock-at-the-door-it-was-a-pelican-in-need-of-help/"
      ]
    },
    {
      "flag": "🇦🇹",
      "place": "奥地利 · 维也纳",
      "title": "狗狗看得出你在害怕",
      "text": "狗狗躺进扫描仪看人脸照片，害怕的脸让它大脑的反应和生气、难过都不一样。",
      "word": {
        "en": "face",
        "zh": "脸"
      },
      "photo_url": "见 credits",
      "photo_credit": "见 credits",
      "photo_pos": "center 30%",
      "photo_shows": "一只金毛犬歪着脑袋，睁大眼睛认真看着镜头",
      "talk": {
        "background": "维也纳的科学家训练宠物狗乖乖躺进核磁共振扫描仪，不绑也不打麻药，给它们看人类开心、生气、害怕的照片。",
        "scale": "狗狗先经过好几个月的练习，才能在轰隆隆的机器里一动不动躺上好几分钟。",
        "follow_up": "你觉得家里的猫或者狗，是怎么看出你不开心的？"
      },
      "sources": [
        "https://www.snexplores.org/article/dogs-read-anger-fear-emotion-human-faces",
        "https://www.sciencenews.org/article/dogs-understand-emotions-humans-face"
      ]
    }
  ],
  "ask_zh": "你怎么看？鹈鹕为什么会去敲人类的门？",
  "ask_en": "Why do you think the pelican knocked on the door?",
  "credits": "来源：News for Kids · CTV · Science News Explores · ADN　照片：Wilfredor (CC0，示意) · F. Schulenburg · Slyronit (CC BY-SA) / Wikimedia Commons",
  "foot": "新闻来源已交叉核实 · 头条照片为示意"
}